{
  "name": "application_type",
  "historyFlag": null,
  "objectReference": null,
  "description": "Довідник типів заяв",
  "columns": {
    "name": {
      "name": "name",
      "description": "Тип заяви",
      "type": "text",
      "defaultValue": null,
      "notNullFlag": true,
      "tableName": "application_type"
    },
    "application_type_id": {
      "name": "application_type_id",
      "description": "Ідентифікатор типів заяв",
      "type": "uuid",
      "defaultValue": "uuid_generate_v4()",
      "notNullFlag": true,
      "tableName": "application_type"
    },
    "constant_code": {
      "name": "constant_code",
      "description": "Символьна константа",
      "type": "text",
      "defaultValue": null,
      "notNullFlag": true,
      "tableName": "application_type"
    }
  },
  "foreignKeys": {},
  "primaryKey": {
    "name": "pk_application_type_id",
    "columns": [
      {
        "name": "application_type_id",
        "sorting": "ASC"
      }
    ],
    "tableName": "application_type"
  },
  "uniqueConstraints": {
    "application_type_name_key": {
      "name": "application_type_name_key",
      "columns": [
        {
          "name": "name",
          "sorting": "ASC"
        }
      ],
      "tableName": "application_type"
    }
  },
  "indices": {}
}